{
  "goals": {
    "cka": {
      "type": "certification",
      "title": "Certified Kubernetes Administrator (CKA)",
      "issuer": "CNCF / Linux Foundation",
      "url": "https://www.cncf.io/training/certification/cka/"
    },
    "ckad": {
      "type": "certification",
      "title": "Certified Kubernetes Application Developer (CKAD)",
      "issuer": "CNCF / Linux Foundation",
      "url": "https://www.cncf.io/training/certification/ckad/"
    },
    "cks": {
      "type": "certification",
      "title": "Certified Kubernetes Security Specialist (CKS)",
      "issuer": "CNCF / Linux Foundation",
      "url": "https://www.cncf.io/training/certification/cks/"
    },
    "aws-dop-c02": {
      "type": "certification",
      "title": "AWS Certified DevOps Engineer – Professional (DOP-C02)",
      "issuer": "AWS",
      "url": "https://docs.aws.amazon.com/aws-certification/latest/devops-engineer-professional-02/devops-engineer-professional-02.html"
    },
    "aws-clf-c02": {
      "type": "certification",
      "title": "AWS Certified Cloud Practitioner (CLF-C02)",
      "issuer": "AWS",
      "url": "https://aws.amazon.com/certification/certified-cloud-practitioner/",
      "note": "Recheck current official page before claiming version alignment."
    },
    "aws-saa-c03": {
      "type": "certification",
      "title": "AWS Certified Solutions Architect – Associate (SAA-C03)",
      "issuer": "AWS",
      "url": "https://aws.amazon.com/certification/certified-solutions-architect-associate/",
      "note": "Recheck current official page before claiming version alignment."
    },
    "aws-dva-c02": {
      "type": "certification",
      "title": "AWS Certified Developer – Associate (DVA-C02)",
      "issuer": "AWS",
      "url": "https://aws.amazon.com/certification/certified-developer-associate/",
      "note": "Recheck current official page before claiming version alignment."
    },
    "uta-mccombs-ai-ml": {
      "type": "certification",
      "title": "UT Austin McCombs AI/ML: Business Applications",
      "issuer": "McCombs School of Business, The University of Texas at Austin",
      "url": "https://onlineexeced.mccombs.utexas.edu/online-ai-machine-learning-course"
    },
    "jhu-whiting-agentic": {
      "type": "certification",
      "title": "Johns Hopkins Whiting AI and Agentic AI Engineering",
      "issuer": "Whiting School of Engineering, Johns Hopkins University",
      "url": "https://online.lifelonglearning.jhu.edu/jhu-certificate-program-ai-agentic-engineering"
    }
  },
  "niche_guidance": [
    {
      "niche": "architecture",
      "reason": "Defend a design using requirements, alternatives, and failure cases."
    },
    {
      "niche": "research",
      "reason": "Answer a bounded question and retain the sources, disagreements, and limits."
    },
    {
      "niche": "writing",
      "reason": "Revise a technical explanation and show why the revision helps."
    },
    {
      "niche": "teaching",
      "reason": "Build a lesson and assessment; use learner feedback when available."
    },
    {
      "niche": "design",
      "reason": "Prototype a useful experience and test it with people when possible."
    },
    {
      "niche": "decisions",
      "reason": "Make a forecast or defended choice, then revisit the actual outcome."
    }
  ],
  "opportunities": [
    {
      "id": "platformlab-cka-exercises",
      "title": "ThePlatformLab CKA practical exercises",
      "provider": "platformlab-cka",
      "materials_url": "https://github.com/theplatformlab/CKA-Certified-Kubernetes-Administrator/tree/802ee2f35412242b7c64be9861f0a7feac367b9e/exercises",
      "target": {
        "collection_path": "niches/code/devops/orchestration/kubernetes/cka/platformlab-exercises",
        "has_subdomain": true,
        "tools": [
          "kubernetes"
        ],
        "goals": [
          "cka"
        ],
        "ordered": true
      },
      "unit": "One complete upstream exercise directory",
      "lab_type": "exercise",
      "priority": "later",
      "adoption": "direct",
      "access": "Public material; review execution requirements before adoption.",
      "evidence_scope": "Committed inventory and Markdown snapshots parsed; license and source separation reviewed at 802ee2f35412242b7c64be9861f0a7feac367b9e. No execution.",
      "checked_on": "2026-10-05",
      "notes": "31 whole exercises and 2 whole mocks adopted in their separate collections. Upstream hints and anecdotes remain attributed source material. Pod Basics has inconsistent nginx versions; the PriorityClass exercise references a missing skeleton.",
      "deliverable": "Manifests or commands, verification output, and an explanation of the failure modes."
    },
    {
      "id": "platformlab-cka-mocks",
      "title": "ThePlatformLab CKA mock exams",
      "provider": "platformlab-cka",
      "materials_url": "https://github.com/theplatformlab/CKA-Certified-Kubernetes-Administrator/tree/802ee2f35412242b7c64be9861f0a7feac367b9e/mock-exams",
      "target": {
        "collection_path": "niches/code/devops/orchestration/kubernetes/cka/platformlab-mock-exams",
        "has_subdomain": true,
        "tools": [
          "kubernetes"
        ],
        "goals": [
          "cka"
        ]
      },
      "unit": "One full mock exam, not one directory per subquestion",
      "lab_type": "problem-set",
      "priority": "later",
      "adoption": "direct",
      "access": "Public material; review execution requirements before adoption.",
      "evidence_scope": "Committed inventory and Markdown snapshots parsed; license and source separation reviewed at 802ee2f35412242b7c64be9861f0a7feac367b9e. No execution.",
      "checked_on": "2026-10-05",
      "notes": "31 whole exercises and 2 whole mocks adopted in their separate collections. Upstream hints and anecdotes remain attributed source material. Pod Basics has inconsistent nginx versions; the PriorityClass exercise references a missing skeleton.",
      "deliverable": "A complete independently attempted practical set, with results and corrections."
    },
    {
      "id": "ckx-cka",
      "title": "CK-X CKA assessment sets",
      "provider": "ck-x",
      "materials_url": "https://github.com/sailor-sh/CK-X/blob/76a78943556af64a774a1c22b283efc22906ff1c/facilitator/assets/exams/labs.json",
      "target": {
        "collection_path": "niches/code/devops/orchestration/kubernetes/cka/ck-x",
        "has_subdomain": true,
        "tools": [
          "kubernetes"
        ],
        "goals": [
          "cka"
        ]
      },
      "unit": "One complete assessment identified by an upstream assessment ID",
      "lab_type": "problem-set",
      "priority": "later",
      "adoption": "direct",
      "access": "Public material; review execution requirements before adoption.",
      "evidence_scope": "Full index, license and selected assessment/config metadata inspected at 76a78943556af64a774a1c22b283efc22906ff1c. No simulator execution.",
      "checked_on": "2026-10-05",
      "notes": "Five whole assessments adopted across CKA (2), CKAD (2) and CKS (1). Bodies, answers and executable assets remain upstream; reuse policy stays review. Docker and Helm Other tracks are excluded.",
      "deliverable": "A reproducible practical attempt; commands, verification and lessons without claiming official exam status."
    },
    {
      "id": "ckx-ckad",
      "title": "CK-X CKAD assessment sets",
      "provider": "ck-x",
      "materials_url": "https://github.com/sailor-sh/CK-X/blob/76a78943556af64a774a1c22b283efc22906ff1c/facilitator/assets/exams/labs.json",
      "target": {
        "collection_path": "niches/code/devops/orchestration/kubernetes/ckad/ck-x",
        "has_subdomain": true,
        "tools": [
          "kubernetes"
        ],
        "goals": [
          "ckad"
        ]
      },
      "unit": "One complete assessment identified by an upstream assessment ID",
      "lab_type": "problem-set",
      "priority": "later",
      "adoption": "direct",
      "access": "Public material; review execution requirements before adoption.",
      "evidence_scope": "Full index, license and selected assessment/config metadata inspected at 76a78943556af64a774a1c22b283efc22906ff1c. No simulator execution.",
      "checked_on": "2026-10-05",
      "notes": "Five whole assessments adopted across CKA (2), CKAD (2) and CKS (1). Bodies, answers and executable assets remain upstream; reuse policy stays review. Docker and Helm Other tracks are excluded.",
      "deliverable": "A reproducible practical attempt; commands, verification and lessons without claiming official exam status."
    },
    {
      "id": "ckx-cks",
      "title": "CK-X CKS assessment sets",
      "provider": "ck-x",
      "materials_url": "https://github.com/sailor-sh/CK-X/blob/76a78943556af64a774a1c22b283efc22906ff1c/facilitator/assets/exams/labs.json",
      "target": {
        "collection_path": "niches/code/devops/orchestration/kubernetes/cks/ck-x",
        "has_subdomain": true,
        "tools": [
          "kubernetes"
        ],
        "goals": [
          "cks"
        ]
      },
      "unit": "One complete assessment identified by an upstream assessment ID",
      "lab_type": "problem-set",
      "priority": "later",
      "adoption": "direct",
      "access": "Public material; review execution requirements before adoption.",
      "evidence_scope": "Full index, license and selected assessment/config metadata inspected at 76a78943556af64a774a1c22b283efc22906ff1c. No simulator execution.",
      "checked_on": "2026-10-05",
      "notes": "Five whole assessments adopted across CKA (2), CKAD (2) and CKS (1). Bodies, answers and executable assets remain upstream; reuse policy stays review. Docker and Helm Other tracks are excluded.",
      "deliverable": "A reproducible practical attempt; commands, verification and lessons without claiming official exam status."
    },
    {
      "id": "cka-objectives-review",